PropertyID,PropertyType,BHK,Area,Rent,Locality,BuildingName,Address,Latitude,Longitude,Amenities,FurnishingStatus,AvailableFrom,MaintenanceCharges,Deposit,PetsAllowed,OwnerName,OwnerContact,LastUpdated,PropertyAge,Description,NearbyPlaces
1118,Independent House,1,504,42000,Adyar,Murugan Nilayam,"2B, East Street, Adyar, Chennai - 600047",13.005926,80.255915,"Club House, Lift, Reserved Parking, Indoor Games, Gated Community, Power Backup, Children's Play Area",Unfurnished,2025-05-22,1000,84000,Yes,Jaya Kumar,6082761002,2025-03-30,2,Spacious 1BHK independent house available for rent in Adyar. Close to all essential facilities and public transport.,"Railway Station, Bank, College, Temple, Mosque, Bus Stop, Shopping Mall"
1119,Apartment,2,768,76000,Madipakkam,Urban Manor,"52, 2nd Street, Madipakkam, Chennai - 600015",12.971193,80.192515,"Swimming Pool, 24x7 Water Supply",Unfurnished,2025-05-16,1500,228000,No,Karthik Kannan,7897422354,2025-02-09,4,Premium 2BHK apartment in Madipakkam with high-quality fittings and amenities. Perfect for family living.,"Church, Metro Station, Shopping Mall, ATM, Temple"
1120,Independent House,2,1103,100000,KK Nagar,Amman Haven,"20A, Nehru Street, KK Nagar, Chennai - 600061",13.039896,80.197098,"ATM, Piped Gas, Fire Safety, Shopping Center",Unfurnished,2025-06-19,2200,300000,No,Lakshmi Venkatesan,8544955030,2025-02-26,4,Elegant 2BHK independent house with excellent ventilation and natural light. Located in a serene neighborhood of KK Nagar.,"Movie Theater, Shopping Mall, Metro Station, Bank, College, Church, Playground"
1121,Apartment,4,1846,100000,Vadapalani,City Mansions,"20, North Street, Vadapalani, Chennai - 600015",13.053992,80.211786,"Gated Community, Shopping Center, Piped Gas",Unfurnished,2025-06-07,3700,200000,No,Meena Govindarajan,6314217562,2025-03-16,3,Elegant 4BHK apartment with excellent ventilation and natural light. Located in a serene neighborhood of Vadapalani.,"Shopping Mall, Cafe, Temple, Bus Stop, Grocery Store, Bank"
1122,Penthouse,3,1478,551000,Tambaram,Elite Tambaram Penthouses,"3B, North Street, Tambaram, Chennai - 600081",12.918351,80.131055,"Gated Community, Security, Power Backup, Service Lift",Semi-furnished,2025-05-20,3000,1102000,No,Siva Krishnan,7982681056,2025-02-08,2,Well-maintained 3BHK penthouse in a gated community. Located in the heart of Tambaram with easy access to all necessities.,"ATM, Church, Restaurant, Playground, Hospital"
1123,Independent House,3,1708,161000,Pallavaram,Shri Villa,"64, Gandhi Road, Pallavaram, Chennai - 600003",12.968331,80.148053,"Gym, Indoor Games, Intercom, 24x7 Water Supply, RO Water System, Club House",Semi-furnished,2025-04-21,3400,483000,No,Geetha Rajan,9033790474,2025-02-14,3,Beautiful 3BHK independent house in a prime location of Pallavaram. Well-ventilated and spacious rooms with modern amenities.,"Hospital, Temple, Restaurant, Mosque, Shopping Mall"
1124,Apartment,3,1117,155000,Royapettah,Classic Complex,"9B, Avenue, Royapettah, Chennai - 600034",13.054105,80.258143,"24x7 Water Supply, Children's Play Area, Lift",Unfurnished,2025-05-22,2200,310000,No,Suresh Ganapathy,9603981079,2025-02-12,7,Elegant 3BHK apartment with excellent ventilation and natural light. Located in a serene neighborhood of Royapettah.,"Pharmacy, Cafe, Grocery Store, Hospital, Gym, Metro Station"
1125,Independent House,4,1947,239000,Anna Nagar,Sri Nilayam,"77, 1st Street, Anna Nagar, Chennai - 600021",13.085117,80.215349,"Multipurpose Room, Club House, 24x7 Water Supply, Park, Fire Safety, Shopping Center",Unfurnished,2025-06-03,3900,717000,Yes,Shankar Venkatesan,7373732695,2025-02-15,2,Elegant 4BHK independent house with excellent ventilation and natural light. Located in a serene neighborhood of Anna Nagar.,"Bank, College, Park, Mosque, Restaurant, Hospital, Grocery Store"
1126,Independent House,4,2318,203000,Sholinganallur,Anbu Mansion,"12A, Gandhi Road, Sholinganallur, Chennai - 600022",12.900346,80.228699,"ATM, Lift, RO Water System, Swimming Pool, Piped Gas, Park",Fully-furnished,2025-05-23,4600,609000,No,Jaya Krishnan,8812126358,2025-03-05,1,Beautiful 4BHK independent house in a prime location of Sholinganallur. Well-ventilated and spacious rooms with modern amenities.,"Grocery Store, Gym, ATM"
1127,Studio Apartment,1,377,14000,Mogappair,Red Studios,"96, Temple Street, Mogappair, Chennai - 600015",13.088914,80.198632,"Gym, Gated Community, Children's Play Area, Club House, Multipurpose Room, Maintenance Staff",Unfurnished,2025-05-07,800,28000,Yes,Shankar Swaminathan,9707713599,2025-04-05,3,Spacious 1BHK studio apartment available for rent in Mogappair. Close to all essential facilities and public transport.,"Mosque, Hospital, College, Church, Bank"
1128,Apartment,2,761,76000,Thiruvanmiyur,Classic Heights,"41, 3rd Street, Thiruvanmiyur, Chennai - 600066",12.987448,80.25602,"Lift, Gym, 24x7 Water Supply",Unfurnished,2025-05-21,1500,228000,Yes,Saranya Raghavan,7023235859,2025-03-10,2,Spacious 2BHK apartment available for rent in Thiruvanmiyur. Close to all essential facilities and public transport.,"College, Gym, School, Movie Theater, Bus Stop, Temple"
1129,Studio Apartment,1,328,22000,Thiruvanmiyur,Classic Studios,"2A, Nehru Street, Thiruvanmiyur, Chennai - 600079",12.987174,80.258317,"Visitor Parking, Gym",Unfurnished,2025-04-21,700,44000,No,Raj Ranganathan,9640403976,2025-02-13,2,Well-maintained 1BHK studio apartment in a gated community. Located in the heart of Thiruvanmiyur with easy access to all necessities.,"Mosque, Railway Station, Shopping Mall, Gym"
1130,Apartment,2,826,57000,Ashok Nagar,Diamond Plaza,"15, Church Street, Ashok Nagar, Chennai - 600032",13.036018,80.212287,"Shopping Center, Intercom, Children's Play Area",Semi-furnished,2025-05-15,1700,114000,No,Srinivas Chandran,6779174312,2025-02-19,6,Elegant 2BHK apartment with excellent ventilation and natural light. Located in a serene neighborhood of Ashok Nagar.,"College, Bank, Movie Theater, Church"
1131,Apartment,4,1531,75000,Chrompet,Crystal Residences,"94, South Street, Chrompet, Chennai - 600090",12.951928,80.147951,"Cafeteria, 24x7 Water Supply",Semi-furnished,2025-07-01,3100,225000,Yes,Vikram Swaminathan,8951869561,2025-02-25,4,Well-maintained 4BHK apartment in a gated community. Located in the heart of Chrompet with easy access to all necessities.,"School, Railway Station, Shopping Mall"
1132,Villa,5,2714,942000,Guindy,Dynasty Estate,"88, Anna Salai, Guindy, Chennai - 600081",13.005011,80.220716,"ATM, RO Water System, 24x7 Water Supply, Intercom",Semi-furnished,2025-06-21,5400,2826000,No,Saranya Ganapathy,8348983763,2025-02-27,5,Beautiful 5BHK villa in a prime location of Guindy. Well-ventilated and spacious rooms with modern amenities.,"ATM, Gym, Bank, College, Metro Station, Mosque, Church"
1133,Villa,3,1701,632000,Nungambakkam,Golden County,"11, Avenue, Nungambakkam, Chennai - 600030",13.056507,80.243902,"Piped Gas, Maintenance Staff, Multipurpose Room, Visitor Parking, Gym",Fully-furnished,2025-05-16,3400,1896000,No,Anitha Rajan,8973995992,2025-02-08,4,Spacious 3BHK villa available for rent in Nungambakkam. Close to all essential facilities and public transport.,"Grocery Store, Pharmacy, Bus Stop, Movie Theater, Metro Station"
1134,Independent House,3,1618,101000,Ashok Nagar,Shri Nilayam,"55, 1st Street, Ashok Nagar, Chennai - 600034",13.03391,80.210419,"Gym, Maintenance Staff, Lift, Intercom",Unfurnished,2025-05-16,3200,202000,No,Lakshmi Balasubramanian,6820918812,2025-03-28,2,Premium 3BHK independent house in Ashok Nagar with high-quality fittings and amenities. Perfect for family living.,"Movie Theater, Cafe, Metro Station, Shopping Mall"
1135,Independent House,1,548,85000,Sholinganallur,Sri Cottage,"86, East Street, Sholinganallur, Chennai - 600022",12.902888,80.228311,"Indoor Games, Service Lift",Semi-furnished,2025-04-14,1100,255000,No,Sudha Parthasarathy,9571178444,2025-02-15,1,Elegant 1BHK independent house with excellent ventilation and natural light. Located in a serene neighborhood of Sholinganallur.,"Hospital, School, Park, Movie Theater, Grocery Store, Playground"
1136,Apartment,3,1196,177000,Thiruvanmiyur,Classic Retreat,"32, Anna Salai, Thiruvanmiyur, Chennai - 600043",12.9844,80.257567,"24x7 Water Supply, Lift, Power Backup, Fire Safety, Children's Play Area",Semi-furnished,2025-05-06,2400,531000,No,Divya Balasubramanian,6155333179,2025-02-10,7,Spacious 3BHK apartment available for rent in Thiruvanmiyur. Close to all essential facilities and public transport.,"Shopping Mall, Gym, Park, Restaurant, Playground, Movie Theater"
1137,Penthouse,3,1607,832000,Besant Nagar,Prestige Besant Nagar Penthouses,"97, Temple Street, Besant Nagar, Chennai - 600058",12.999706,80.270171,"Rain Water Harvesting, Park, Visitor Parking, Multipurpose Room, ATM",Unfurnished,2025-05-31,3200,2496000,No,Sudha Govindarajan,9932096672,2025-02-16,1,Premium 3BHK penthouse in Besant Nagar with high-quality fittings and amenities. Perfect for family living.,"Church, Metro Station, Bus Stop"
1138,Apartment,1,364,31000,West Mambalam,Green Nivas,"8C, South Street, West Mambalam, Chennai - 600065",13.037753,80.217672,"Lift, Reserved Parking",Unfurnished,2025-05-10,700,62000,Yes,Mohan Iyer,6596807852,2025-03-10,3,Spacious 1BHK apartment available for rent in West Mambalam. Close to all essential facilities and public transport.,"Restaurant, Shopping Mall, Temple, Mosque, Church"
1139,Studio Apartment,2,652,41000,Kodambakkam,Metro Studios,"68, East Street, Kodambakkam, Chennai - 600044",13.053162,80.223931,"Multipurpose Room, 24x7 Water Supply, Club House",Semi-furnished,2025-04-10,1300,123000,Yes,Prasad Swaminathan,9875374126,2025-04-06,1,Premium 2BHK studio apartment in Kodambakkam with high-quality fittings and amenities. Perfect for family living.,"Railway Station, Shopping Mall, Grocery Store"
1140,Villa,3,1832,737000,Adyar,Dynasty Villas,"11, 3rd Street, Adyar, Chennai - 600018",13.004284,80.257795,"24x7 Water Supply, Lift, Reserved Parking",Fully-furnished,2025-05-13,3700,1474000,No,Mala Subramanian,8133860792,2025-03-03,4,Spacious 3BHK villa available for rent in Adyar. Close to all essential facilities and public transport.,"Bus Stop, Railway Station, Movie Theater, College, Gym, Playground"
1141,Apartment,2,771,140000,Nungambakkam,Golden Haven,"19A, Avenue, Nungambakkam, Chennai - 600083",13.056345,80.242489,"Piped Gas, Power Backup, Service Lift",Fully-furnished,2025-05-08,1500,280000,No,Lakshmi Ganapathy,7606295350,2025-03-31,4,Premium 2BHK apartment in Nungambakkam with high-quality fittings and amenities. Perfect for family living.,"Shopping Mall, ATM, Railway Station, Church, Restaurant"
1142,Apartment,1,428,70000,Nungambakkam,Grand Illam,"14, East Street, Nungambakkam, Chennai - 600054",13.059326,80.240869,"ATM, Shopping Center, Children's Play Area",Fully-furnished,2025-05-11,900,140000,No,Kavitha Ramanathan,9985448789,2025-04-04,1,Spacious 1BHK apartment available for rent in Nungambakkam. Close to all essential facilities and public transport.,"College, Gym, Hospital, Mosque, Cafe, Metro Station"
1143,Independent House,2,1156,72000,Perungudi,Arul Illam,"16, South Street, Perungudi, Chennai - 600085",12.964127,80.251354,"Visitor Parking, Lift, Security, Rain Water Harvesting, Power Backup, ATM",Fully-furnished,2025-06-01,2300,144000,No,Venkat Venkatesan,6572245883,2025-02-06,7,Well-maintained 2BHK independent house in a gated community. Located in the heart of Perungudi with easy access to all necessities.,"Metro Station, Pharmacy, College, ATM"
1144,Independent House,2,935,156000,West Mambalam,Arun Abode,"76, West Street, West Mambalam, Chennai - 600087",13.039453,80.220063,"Swimming Pool, Fire Safety, Gated Community, Club House",Semi-furnished,2025-04-16,1900,468000,No,Vijaya Ganapathy,8323814331,2025-03-05,4,Well-maintained 2BHK independent house in a gated community. Located in the heart of West Mambalam with easy access to all necessities.,"Bus Stop, Shopping Mall, Railway Station, Playground, Park, Cafe, Metro Station"
1145,Apartment,1,505,43000,Velachery,Classic Gardens,"67, 3rd Street, Velachery, Chennai - 600061",12.980749,80.217111,"ATM, Gym, Maintenance Staff, Power Backup, Club House, Indoor Games",Unfurnished,2025-05-05,1000,86000,Yes,Jaya Pillai,8702150134,2025-03-18,7,Beautiful 1BHK apartment in a prime location of Velachery. Well-ventilated and spacious rooms with modern amenities.,"Church, School, Grocery Store, Temple, Bus Stop"
1146,Apartment,2,809,58000,Nungambakkam,Metro Villas,"81, Temple Street, Nungambakkam, Chennai - 600082",13.058717,80.241781,"Swimming Pool, Gated Community, Gym, Club House, Maintenance Staff, Shopping Center",Unfurnished,2025-06-02,1600,174000,No,Divya Narayanan,7648849979,2025-02-16,3,Elegant 2BHK apartment with excellent ventilation and natural light. Located in a serene neighborhood of Nungambakkam.,"Metro Station, Restaurant, Pharmacy"
1147,Independent House,3,1668,162000,Medavakkam,Arul Abode,"46, Cross Street, Medavakkam, Chennai - 600065",12.918022,80.19091,"Swimming Pool, Gated Community, Security",Unfurnished,2025-05-17,3300,486000,No,Radha Parthasarathy,9042385247,2025-03-22,7,Elegant 3BHK independent house with excellent ventilation and natural light. Located in a serene neighborhood of Medavakkam.,"Church, Bus Stop, Metro Station, Movie Theater, Gym, School"
1148,Studio Apartment,1,427,25000,Mylapore,Urban Studios,"42, Church Street, Mylapore, Chennai - 600024",13.033787,80.269961,"Indoor Games, Shopping Center, Club House, Multipurpose Room",Semi-furnished,2025-05-02,900,50000,Yes,Priya Chandran,8967183239,2025-02-06,3,Elegant 1BHK studio apartment with excellent ventilation and natural light. Located in a serene neighborhood of Mylapore.,"ATM, Cafe, Bank, Movie Theater, Church, Restaurant, Park"
1149,Apartment,3,1461,101000,KK Nagar,Diamond Homes,"95, Nehru Street, KK Nagar, Chennai - 600033",13.037257,80.199008,"Rain Water Harvesting, Reserved Parking, Multipurpose Room",Fully-furnished,2025-05-06,2900,303000,No,Deepa Kannan,6659916247,2025-04-05,7,Elegant 3BHK apartment with excellent ventilation and natural light. Located in a serene neighborhood of KK Nagar.,"Railway Station, Gym, Movie Theater, Grocery Store, Pharmacy, Temple, Bus Stop"
1150,Studio Apartment,1,352,25000,Nanganallur,Elegant Studios,"71, Anna Salai, Nanganallur, Chennai - 600083",12.987181,80.190665,"RO Water System, Maintenance Staff, Cafeteria, Piped Gas, Children's Play Area, Multipurpose Room",Fully-furnished,2025-07-03,700,75000,No,Sudha Raghavan,8396756765,2025-04-03,5,Spacious 1BHK studio apartment available for rent in Nanganallur. Close to all essential facilities and public transport.,"Bus Stop, Church, Bank, Gym"
1151,Independent House,1,444,101000,Besant Nagar,Durga Nilayam,"10B, Main Road, Besant Nagar, Chennai - 600013",12.999716,80.271345,"Children's Play Area, Multipurpose Room, Piped Gas, Reserved Parking, Lift",Unfurnished,2025-06-16,900,202000,No,Jaya Viswanathan,8359242384,2025-04-04,3,Spacious 1BHK independent house available for rent in Besant Nagar. Close to all essential facilities and public transport.,"Gym, Hospital, Metro Station, Church, Mosque"
1152,Penthouse,2,1098,328000,Kodambakkam,Silver Kodambakkam Penthouses,"11B, Gandhi Road, Kodambakkam, Chennai - 600033",13.050715,80.220254,"Visitor Parking, Rain Water Harvesting, Service Lift, Shopping Center, Reserved Parking",Fully-furnished,2025-04-23,2200,656000,No,Ramesh Srinivasan,9521562783,2025-02-20,1,Spacious 2BHK penthouse available for rent in Kodambakkam. Close to all essential facilities and public transport.,"Hospital, Bank, Movie Theater, Railway Station, School, Pharmacy, Restaurant"
1153,Independent House,4,2339,191000,Madipakkam,Durga Palace,"4C, 1st Street, Madipakkam, Chennai - 600100",12.968605,80.192358,"Maintenance Staff, Security, Visitor Parking, RO Water System, Shopping Center",Semi-furnished,2025-05-01,4700,382000,No,Geetha Sundaram,9164466847,2025-02-16,2,Well-maintained 4BHK independent house in a gated community. Located in the heart of Madipakkam with easy access to all necessities.,"Park, Grocery Store, Metro Station, Restaurant, School, Gym"
1154,Independent House,2,1164,176000,Sholinganallur,Arul Mahal,"66, Church Street, Sholinganallur, Chennai - 600029",12.900487,80.229596,"Club House, RO Water System",Fully-furnished,2025-06-23,2300,528000,No,Saranya Ramachandran,8853358499,2025-03-21,6,Beautiful 2BHK independent house in a prime location of Sholinganallur. Well-ventilated and spacious rooms with modern amenities.,"ATM, Church, Shopping Mall, Metro Station, Hospital"
1155,Independent House,3,1400,229000,Anna Nagar,Amman Cottage,"27, 3rd Street, Anna Nagar, Chennai - 600092",13.088346,80.217022,"Security, Power Backup, Indoor Games",Fully-furnished,2025-05-29,2800,458000,No,Rajan Sampath,7564686676,2025-03-17,3,Beautiful 3BHK independent house in a prime location of Anna Nagar. Well-ventilated and spacious rooms with modern amenities.,"Movie Theater, Grocery Store, Bank, Church, Park, Gym"
1156,Apartment,3,1253,82000,Mogappair,Crystal Oasis,"86, 3rd Street, Mogappair, Chennai - 600065",13.089518,80.198147,"Piped Gas, Power Backup, Indoor Games, Swimming Pool, Rain Water Harvesting, Maintenance Staff",Unfurnished,2025-05-23,2500,246000,Yes,Hari Rajan,6445657267,2025-03-21,7,Well-maintained 3BHK apartment in a gated community. Located in the heart of Mogappair with easy access to all necessities.,"School, Grocery Store, Pharmacy, Playground, Railway Station, Shopping Mall"
1157,Penthouse,2,1102,260000,Royapettah,Blue Royapettah Penthouses,"87, Avenue, Royapettah, Chennai - 600012",13.054608,80.25997,"Service Lift, RO Water System",Unfurnished,2025-06-19,2200,520000,No,Vikram Viswanathan,6097848389,2025-02-17,2,Spacious 2BHK penthouse available for rent in Royapettah. Close to all essential facilities and public transport.,"Shopping Mall, Gym, Railway Station, Pharmacy, Grocery Store"
1158,Independent House,3,1531,102000,Perungudi,Thiru House,"7C, 3rd Street, Perungudi, Chennai - 600080",12.966486,80.249158,"Security, Indoor Games, 24x7 Water Supply, Service Lift, Park, Multipurpose Room",Semi-furnished,2025-06-30,3100,204000,Yes,Priya Ramachandran,9635931215,2025-04-06,2,Well-maintained 3BHK independent house in a gated community. Located in the heart of Perungudi with easy access to all necessities.,"Temple, Bus Stop, School, Grocery Store"
1159,Apartment,1,464,54000,Kilpauk,Urban Residences,"68, South Street, Kilpauk, Chennai - 600072",13.073423,80.232848,"Intercom, Gated Community, Power Backup",Semi-furnished,2025-05-10,900,162000,Yes,Vijay Narayanan,8679406015,2025-02-12,7,Spacious 1BHK apartment available for rent in Kilpauk. Close to all essential facilities and public transport.,"Park, School, Grocery Store, Bank, College, Restaurant, Shopping Mall"
1160,Penthouse,2,1074,524000,Besant Nagar,Royal Besant Nagar Penthouses,"69, Temple Street, Besant Nagar, Chennai - 600018",12.998096,80.272466,"Multipurpose Room, Gym, 24x7 Water Supply, Rain Water Harvesting, Intercom, Cafeteria",Fully-furnished,2025-06-08,2100,1048000,No,Radha Sampath,7572998726,2025-02-12,1,Beautiful 2BHK penthouse in a prime location of Besant Nagar. Well-ventilated and spacious rooms with modern amenities.,"School, Bank, Railway Station, Restaurant, Church, Mosque, Hospital"
1161,Villa,3,1940,441000,West Mambalam,Golden Oasis,"10B, Avenue, West Mambalam, Chennai - 600045",13.036644,80.218697,"Swimming Pool, 24x7 Water Supply, Lift, ATM",Unfurnished,2025-06-11,3900,1323000,No,Divya Kannan,7545117559,2025-02-19,3,Well-maintained 3BHK villa in a gated community. Located in the heart of West Mambalam with easy access to all necessities.,"Grocery Store, Gym, Temple, Hospital, Mosque, Church, College"
1162,Independent House,1,521,46000,Madipakkam,Arun Cottage,"50, 3rd Street, Madipakkam, Chennai - 600096",12.968181,80.189626,"Gated Community, Rain Water Harvesting, Gym",Unfurnished,2025-06-09,1000,138000,Yes,Ramesh Ramachandran,7409676242,2025-02-22,6,Beautiful 1BHK independent house in a prime location of Madipakkam. Well-ventilated and spacious rooms with modern amenities.,"Bank, Park, Metro Station, Playground, Hospital, School, Grocery Store"
1163,Studio Apartment,2,743,33000,Pallavaram,Elite Studios,"21, Main Road, Pallavaram, Chennai - 600080",12.966781,80.150794,"Cafeteria, Multipurpose Room",Semi-furnished,2025-04-26,1500,99000,No,Jaya Murugan,6585989344,2025-03-25,4,Beautiful 2BHK studio apartment in a prime location of Pallavaram. Well-ventilated and spacious rooms with modern amenities.,"College, Metro Station, School, Temple"
1164,Independent House,2,880,91000,Vadapalani,Shiva Villa,"67, South Street, Vadapalani, Chennai - 600046",13.055551,80.21096,"Intercom, Gym, Fire Safety, Service Lift, Maintenance Staff",Semi-furnished,2025-04-21,1800,273000,No,Vijay Iyer,9981819242,2025-03-29,3,Well-maintained 2BHK independent house in a gated community. Located in the heart of Vadapalani with easy access to all necessities.,"Park, School, Shopping Mall, Movie Theater"
1165,Apartment,2,979,87000,Royapettah,Elite Arcade,"57, Anna Salai, Royapettah, Chennai - 600082",13.056518,80.259385,"Reserved Parking, Club House, Swimming Pool, Service Lift, Indoor Games",Fully-furnished,2025-06-28,2000,261000,No,Srinivas Iyer,9520499809,2025-03-31,3,Premium 2BHK apartment in Royapettah with high-quality fittings and amenities. Perfect for family living.,"Restaurant, Pharmacy, Park"
1166,Independent House,1,447,66000,West Mambalam,Kaveri Villa,"35, 2nd Street, West Mambalam, Chennai - 600003",13.038101,80.217242,"Swimming Pool, Intercom, Power Backup, Club House",Unfurnished,2025-05-19,900,132000,No,Vijay Anand,6127793333,2025-03-05,7,Well-maintained 1BHK independent house in a gated community. Located in the heart of West Mambalam with easy access to all necessities.,"Park, ATM, Church"
1167,Villa,3,2327,508000,Anna Nagar,Green Manor,"8B, 3rd Street, Anna Nagar, Chennai - 600019",13.086442,80.214903,"Park, Lift, Club House, Maintenance Staff",Unfurnished,2025-06-25,4700,1524000,Yes,Deepa Viswanathan,6224282344,2025-03-21,2,Premium 3BHK villa in Anna Nagar with high-quality fittings and amenities. Perfect for family living.,"Park, Movie Theater, Temple, Metro Station, Bank, Shopping Mall"
1168,Villa,4,2309,280000,Tambaram,Palm Greens,"49, 1st Street, Tambaram, Chennai - 600006",12.918042,80.128699,"ATM, Indoor Games",Unfurnished,2025-06-11,4600,840000,No,Siva Murugan,8074375177,2025-02-25,4,Spacious 4BHK villa available for rent in Tambaram. Close to all essential facilities and public transport.,"College, Railway Station, Grocery Store, Mosque, Movie Theater, ATM"
1169,Independent House,3,1397,315000,Nungambakkam,Amman House,"97, West Street, Nungambakkam, Chennai - 600019",13.054897,80.241204,"Rain Water Harvesting, Reserved Parking, Shopping Center, Piped Gas, Children's Play Area, Service Lift, Lift",Semi-furnished,2025-04-24,2800,945000,No,Mohan Krishnan,7955296435,2025-02-12,2,Spacious 3BHK independent house available for rent in Nungambakkam. Close to all essential facilities and public transport.,"Metro Station, Gym, Park, ATM, Grocery Store, Shopping Mall"
1170,Studio Apartment,1,376,23000,Sholinganallur,Deluxe Studios,"65, Kamaraj Salai, Sholinganallur, Chennai - 600096",12.903008,80.227188,"Indoor Games, Cafeteria, Gym, Club House, Children's Play Area",Unfurnished,2025-04-29,800,46000,No,Radha Iyengar,8880671917,2025-03-01,3,Well-maintained 1BHK studio apartment in a gated community. Located in the heart of Sholinganallur with easy access to all necessities.,"Mosque, Metro Station, Cafe, Gym"
1171,Independent House,4,2135,280000,West Mambalam,Durga Illam,"55, Anna Salai, West Mambalam, Chennai - 600038",13.037125,80.219803,"Visitor Parking, Service Lift, Piped Gas",Semi-furnished,2025-06-17,4300,840000,No,Anitha Ganapathy,8043494815,2025-04-05,5,Spacious 4BHK independent house available for rent in West Mambalam. Close to all essential facilities and public transport.,"Bus Stop, Grocery Store, Park, Pharmacy, Shopping Mall, Mosque"
1172,Apartment,3,1433,78000,Besant Nagar,Crystal Habitat,"21, 3rd Street, Besant Nagar, Chennai - 600008",12.998339,80.272461,"Visitor Parking, Gated Community, RO Water System, Swimming Pool, Shopping Center, Club House",Unfurnished,2025-06-20,2900,234000,No,Mohan Iyengar,8388487920,2025-04-04,4,Beautiful 3BHK apartment in a prime location of Besant Nagar. Well-ventilated and spacious rooms with modern amenities.,"Gym, Playground, College, Grocery Store"
1173,Studio Apartment,1,369,10000,Medavakkam,Urban Studios,"64, Avenue, Medavakkam, Chennai - 600038",12.918992,80.192859,"ATM, Club House",Unfurnished,2025-07-05,700,30000,No,Priya Sampath,6670644093,2025-03-26,1,Premium 1BHK studio apartment in Medavakkam with high-quality fittings and amenities. Perfect for family living.,"Mosque, Railway Station, Metro Station, Church, Bus Stop, Grocery Store, Bank"
1174,Studio Apartment,1,458,10000,Tambaram,Pearl Studios,"5C, Cross Street, Tambaram, Chennai - 600025",12.917768,80.126355,"Power Backup, Indoor Games, Reserved Parking, 24x7 Water Supply",Unfurnished,2025-05-06,900,20000,No,Ramesh Ramachandran,6762386582,2025-02-07,4,Premium 1BHK studio apartment in Tambaram with high-quality fittings and amenities. Perfect for family living.,"ATM, Hospital, Bus Stop"
1175,Apartment,3,1240,93000,Madipakkam,Emerald Heights,"62, Gandhi Road, Madipakkam, Chennai - 600022",12.970528,80.1924,"Lift, Shopping Center, 24x7 Water Supply, Cafeteria, Maintenance Staff, ATM",Semi-furnished,2025-06-22,2500,186000,No,Anitha Rajendran,7201223414,2025-02-06,3,Well-maintained 3BHK apartment in a gated community. Located in the heart of Madipakkam with easy access to all necessities.,"Gym, Bus Stop, Bank, Movie Theater"
