PropertyID,PropertyType,BHK,Area,Rent,Locality,BuildingName,Address,Latitude,Longitude,Amenities,FurnishingStatus,AvailableFrom,MaintenanceCharges,Deposit,PetsAllowed,OwnerName,OwnerContact,LastUpdated,PropertyAge,Description,NearbyPlaces
707,Villa,4,2663,564000,Guindy,Green Woods,"50, North Street, Guindy, Chennai - 600086",13.007991,80.221666,"RO Water System, Gated Community, 24x7 Water Supply, Intercom, Cafeteria, Gym",Unfurnished,2025-06-02,5300,1692000,No,Karthik Kumar,6355278451,2025-03-24,2,Beautiful 4BHK villa in a prime location of Guindy. Well-ventilated and spacious rooms with modern amenities.,"Park, Mosque, Hospital, Bus Stop, School"
708,Independent House,4,1745,410000,Besant Nagar,Anbu Villa,"3, Temple Street, Besant Nagar, Chennai - 600025",13.000361,80.273529,"Visitor Parking, Multipurpose Room, Service Lift, Children's Play Area, Park, Piped Gas, Shopping Center",Unfurnished,2025-06-03,3500,820000,No,Sudha Raghavan,8039500786,2025-04-02,4,Beautiful 4BHK independent house in a prime location of Besant Nagar. Well-ventilated and spacious rooms with modern amenities.,"Railway Station, Pharmacy, Temple, Shopping Mall, School"
709,Villa,4,2207,256000,Vadapalani,Exquisite Paradise,"7C, 1st Street, Vadapalani, Chennai - 600089",13.054694,80.213141,"Fire Safety, Gated Community, Multipurpose Room, Gym, RO Water System",Unfurnished,2025-06-30,4400,512000,No,Arun Raghavan,7031827369,2025-03-20,7,Spacious 4BHK villa available for rent in Vadapalani. Close to all essential facilities and public transport.,"Cafe, School, Pharmacy"
710,Penthouse,3,1623,1328000,T. Nagar,Saravana T. Nagar Penthouses,"5, South Street, T. Nagar, Chennai - 600026",13.039998,80.232373,"Multipurpose Room, Intercom, Club House, Gym, Lift, Fire Safety",Semi-furnished,2025-06-14,3200,2656000,No,Karthik Srinivasan,7396600986,2025-02-06,4,Beautiful 3BHK penthouse in a prime location of T. Nagar. Well-ventilated and spacious rooms with modern amenities.,"Gym, Park, Movie Theater, Playground, Church, Temple"
711,Studio Apartment,1,345,28000,KK Nagar,Modern Studios,"40, 2nd Street, KK Nagar, Chennai - 600005",13.039081,80.196724,"Multipurpose Room, Club House, Intercom, Fire Safety, ATM",Semi-furnished,2025-06-24,700,56000,No,Priya Narayanan,6293658834,2025-04-06,6,Beautiful 1BHK studio apartment in a prime location of KK Nagar. Well-ventilated and spacious rooms with modern amenities.,"Shopping Mall, Bus Stop, Cafe, Temple, Church, Hospital, Bank"
712,Independent House,2,950,80000,Thiruvanmiyur,Thamizh Illam,"35, Main Road, Thiruvanmiyur, Chennai - 600038",12.987396,80.258289,"Maintenance Staff, Visitor Parking, RO Water System, Reserved Parking, Fire Safety, Security",Semi-furnished,2025-05-16,1900,240000,Yes,Vani Kannan,7985117426,2025-02-14,1,Premium 2BHK independent house in Thiruvanmiyur with high-quality fittings and amenities. Perfect for family living.,"Grocery Store, Bank, Cafe, Bus Stop, Metro Station, Movie Theater"
713,Apartment,1,396,66000,T. Nagar,Deluxe Palms,"17A, Church Street, T. Nagar, Chennai - 600014",13.04077,80.236595,"ATM, Visitor Parking, Reserved Parking, Service Lift",Fully-furnished,2025-06-16,800,198000,No,Ganesh Sundaram,8599940041,2025-02-23,1,Beautiful 1BHK apartment in a prime location of T. Nagar. Well-ventilated and spacious rooms with modern amenities.,"Temple, Movie Theater, College, Metro Station"
714,Independent House,3,1574,111000,Perambur,Nila Cottage,"5B, 3rd Street, Perambur, Chennai - 600003",13.118194,80.243024,"Shopping Center, ATM, Children's Play Area",Semi-furnished,2025-06-13,3100,222000,No,Saraswathi Natarajan,8631413503,2025-04-01,8,Elegant 3BHK independent house with excellent ventilation and natural light. Located in a serene neighborhood of Perambur.,"Gym, Grocery Store, Railway Station, College, Church, Hospital"
715,Independent House,2,1004,63000,Choolaimedu,Amman Palace,"5B, Gandhi Road, Choolaimedu, Chennai - 600073",13.073879,80.220909,"RO Water System, Shopping Center, Cafeteria, Lift, Gym",Semi-furnished,2025-07-02,2000,126000,Yes,Radha Balasubramanian,7741228767,2025-02-22,1,Premium 2BHK independent house in Choolaimedu with high-quality fittings and amenities. Perfect for family living.,"Bank, Shopping Mall, Restaurant, Movie Theater, Playground"
716,Apartment,2,1031,108000,T. Nagar,Sunshine Arcade,"11B, Avenue, T. Nagar, Chennai - 600081",13.042965,80.233682,"Maintenance Staff, Piped Gas, Service Lift, Visitor Parking",Semi-furnished,2025-06-18,2100,216000,No,Sunitha Pillai,7211175494,2025-02-27,3,Elegant 2BHK apartment with excellent ventilation and natural light. Located in a serene neighborhood of T. Nagar.,"Mosque, College, ATM, Bank"
717,Studio Apartment,2,726,40000,Velachery,Metro Studios,"28, Avenue, Velachery, Chennai - 600059",12.982787,80.215965,"Multipurpose Room, Gated Community, ATM, Swimming Pool",Unfurnished,2025-04-23,1500,80000,Yes,Saranya Sampath,6642369170,2025-02-25,2,Spacious 2BHK studio apartment available for rent in Velachery. Close to all essential facilities and public transport.,"Pharmacy, Movie Theater, College, Gym, Church"
718,Apartment,4,1749,52000,Madipakkam,Shri Arcade,"67, Main Road, Madipakkam, Chennai - 600098",12.971021,80.192305,"Multipurpose Room, Maintenance Staff, Rain Water Harvesting, Piped Gas",Unfurnished,2025-05-20,3500,156000,Yes,Vijaya Shanmugam,9257349899,2025-02-26,3,Elegant 4BHK apartment with excellent ventilation and natural light. Located in a serene neighborhood of Madipakkam.,"Railway Station, College, Church, Bus Stop, Movie Theater, Park, Shopping Mall"
719,Studio Apartment,1,393,15000,Nanganallur,Red Studios,"93, Kamaraj Salai, Nanganallur, Chennai - 600020",12.988038,80.194708,"Indoor Games, RO Water System",Semi-furnished,2025-04-10,800,30000,Yes,Gopal Iyengar,6557270592,2025-03-19,6,Well-maintained 1BHK studio apartment in a gated community. Located in the heart of Nanganallur with easy access to all necessities.,"ATM, Restaurant, Playground, Mosque, Bus Stop"
720,Apartment,1,482,12000,Tambaram,Shri Complex,"46, Nehru Street, Tambaram, Chennai - 600037",12.916779,80.131122,"RO Water System, Power Backup, Children's Play Area, Maintenance Staff",Unfurnished,2025-04-26,1000,24000,Yes,Lakshmi Sundaram,9072720814,2025-03-18,4,Spacious 1BHK apartment available for rent in Tambaram. Close to all essential facilities and public transport.,"Temple, Cafe, Park, College, Restaurant, Bus Stop, Shopping Mall"
721,Independent House,2,883,80000,Sholinganallur,Vaigai House,"4B, Gandhi Road, Sholinganallur, Chennai - 600083",12.902022,80.230163,"RO Water System, Intercom, Maintenance Staff, Multipurpose Room",Semi-furnished,2025-06-17,1800,240000,Yes,Mohan Shanmugam,6999007256,2025-03-09,4,Spacious 2BHK independent house available for rent in Sholinganallur. Close to all essential facilities and public transport.,"Grocery Store, Hospital, Park, Temple, Movie Theater, Restaurant"
722,Apartment,1,509,55000,Kodambakkam,Lakshmi Mahal,"66, 1st Street, Kodambakkam, Chennai - 600003",13.053218,80.223834,"Rain Water Harvesting, Reserved Parking, Cafeteria, Children's Play Area, Intercom",Semi-furnished,2025-05-13,1000,165000,No,Lakshmi Chandran,7987920623,2025-03-30,1,Well-maintained 1BHK apartment in a gated community. Located in the heart of Kodambakkam with easy access to all necessities.,"Church, Restaurant, Gym, Bus Stop, Grocery Store, Cafe"
723,Apartment,2,827,37000,Guindy,Golden Villas,"25, Avenue, Guindy, Chennai - 600019",13.007225,80.21825,"Rain Water Harvesting, ATM, Intercom, Security, RO Water System",Semi-furnished,2025-04-25,1700,74000,Yes,Siva Rajan,8344225216,2025-02-27,1,Well-maintained 2BHK apartment in a gated community. Located in the heart of Guindy with easy access to all necessities.,"Bus Stop, Railway Station, Gym"
724,Apartment,2,965,121000,Nungambakkam,Red Enclave,"4B, Cross Street, Nungambakkam, Chennai - 600091",13.059088,80.24053,"Intercom, 24x7 Water Supply, Power Backup, Park, Multipurpose Room",Unfurnished,2025-04-28,1900,242000,No,Meena Venkatesh,6237179890,2025-02-20,2,Well-maintained 2BHK apartment in a gated community. Located in the heart of Nungambakkam with easy access to all necessities.,"Movie Theater, Shopping Mall, College, School, Bank"
725,Villa,5,3372,1008000,Thiruvanmiyur,Palm Grove,"13A, Church Street, Thiruvanmiyur, Chennai - 600066",12.986454,80.259138,"Gated Community, Cafeteria, RO Water System",Unfurnished,2025-05-24,6700,3024000,Yes,Vijay Sampath,7753946343,2025-02-17,1,Well-maintained 5BHK villa in a gated community. Located in the heart of Thiruvanmiyur with easy access to all necessities.,"Shopping Mall, ATM, Temple, Church, Mosque, Hospital"
726,Independent House,2,1051,126000,Perambur,Shri House,"3B, Anna Salai, Perambur, Chennai - 600057",13.113734,80.241929,"Swimming Pool, RO Water System",Fully-furnished,2025-05-28,2100,378000,No,Hari Iyengar,8837331074,2025-02-07,8,Beautiful 2BHK independent house in a prime location of Perambur. Well-ventilated and spacious rooms with modern amenities.,"Park, Church, Playground"
727,Apartment,3,1395,84000,Perungudi,Metro Homes,"80, 1st Street, Perungudi, Chennai - 600027",12.963859,80.248781,"Children's Play Area, Intercom, Visitor Parking, Reserved Parking",Unfurnished,2025-04-14,2800,168000,No,Padma Srinivasan,7484203531,2025-03-22,7,Beautiful 3BHK apartment in a prime location of Perungudi. Well-ventilated and spacious rooms with modern amenities.,"Playground, Mosque, Shopping Mall, Restaurant, Pharmacy"
728,Independent House,3,1762,122000,Anna Nagar,Murugan Villa,"45, Church Street, Anna Nagar, Chennai - 600021",13.087942,80.215888,"24x7 Water Supply, Cafeteria, Indoor Games, RO Water System",Unfurnished,2025-04-25,3500,244000,Yes,Arun Balasubramanian,9438935317,2025-04-02,2,Beautiful 3BHK independent house in a prime location of Anna Nagar. Well-ventilated and spacious rooms with modern amenities.,"Restaurant, Grocery Store, Playground"
729,Independent House,2,968,87000,Guindy,Vaigai House,"14, Temple Street, Guindy, Chennai - 600097",13.007426,80.219333,"Club House, Rain Water Harvesting, Visitor Parking, Maintenance Staff",Unfurnished,2025-06-13,1900,261000,Yes,Arun Iyengar,7116386101,2025-02-18,1,Elegant 2BHK independent house with excellent ventilation and natural light. Located in a serene neighborhood of Guindy.,"Shopping Mall, Pharmacy, Playground, Cafe, Bus Stop"
730,Independent House,2,1220,69000,Valasaravakkam,Lakshmi Mahal,"99, Anna Salai, Valasaravakkam, Chennai - 600047",13.044971,80.182484,"Park, Piped Gas, Fire Safety, Visitor Parking",Unfurnished,2025-06-20,2400,138000,No,Sunitha Viswanathan,6895919053,2025-03-18,1,Elegant 2BHK independent house with excellent ventilation and natural light. Located in a serene neighborhood of Valasaravakkam.,"Movie Theater, Railway Station, Park"
731,Independent House,1,502,27000,Perambur,Saravana Bhavan,"28, North Street, Perambur, Chennai - 600075",13.11515,80.238191,"Park, Lift",Fully-furnished,2025-04-27,1000,54000,No,Raj Venkatesh,6945058360,2025-02-15,8,Well-maintained 1BHK independent house in a gated community. Located in the heart of Perambur with easy access to all necessities.,"Movie Theater, Metro Station, Restaurant, Mosque"
732,Independent House,2,1194,181000,T. Nagar,Saravana Nilayam,"3C, Church Street, T. Nagar, Chennai - 600012",13.040189,80.23462,"Rain Water Harvesting, Club House, Cafeteria",Fully-furnished,2025-05-16,2400,362000,No,Vijay Sundaram,7787181938,2025-03-09,2,Premium 2BHK independent house in T. Nagar with high-quality fittings and amenities. Perfect for family living.,"Hospital, Playground, Railway Station"
733,Independent House,3,1750,120000,Nanganallur,Ganesh Palace,"3, East Street, Nanganallur, Chennai - 600042",12.990507,80.195017,"Intercom, Maintenance Staff, Multipurpose Room",Semi-furnished,2025-06-16,3500,240000,No,Krishna Pillai,6071500665,2025-02-27,3,Beautiful 3BHK independent house in a prime location of Nanganallur. Well-ventilated and spacious rooms with modern amenities.,"Grocery Store, Mosque, ATM, Metro Station, Temple, Bus Stop"
734,Apartment,3,1224,87000,T. Nagar,Blue Haven,"25, Avenue, T. Nagar, Chennai - 600021",13.040231,80.231989,"Indoor Games, Gated Community, Club House, Security, Intercom",Fully-furnished,2025-04-22,2400,261000,No,Priya Murugan,8629620805,2025-02-14,2,Elegant 3BHK apartment with excellent ventilation and natural light. Located in a serene neighborhood of T. Nagar.,"Gym, Hospital, Movie Theater"
735,Apartment,2,810,78000,Nungambakkam,Prestige Court,"18A, 3rd Street, Nungambakkam, Chennai - 600001",13.05765,80.240792,"Park, ATM, Security, Indoor Games, Visitor Parking, Fire Safety, Rain Water Harvesting",Unfurnished,2025-04-27,1600,234000,No,Shankar Viswanathan,6524948918,2025-03-29,3,Well-maintained 2BHK apartment in a gated community. Located in the heart of Nungambakkam with easy access to all necessities.,"Hospital, Park, Temple, Bank, Restaurant"
736,Studio Apartment,2,751,73000,Nungambakkam,Diamond Studios,"25, Main Road, Nungambakkam, Chennai - 600067",13.055244,80.243592,"Shopping Center, Multipurpose Room, Gym, Lift, Reserved Parking",Unfurnished,2025-06-10,1500,219000,No,Sudha Rajendran,8335717685,2025-03-30,2,Elegant 2BHK studio apartment with excellent ventilation and natural light. Located in a serene neighborhood of Nungambakkam.,"Pharmacy, Shopping Mall, Railway Station, Restaurant, Park, Playground, Metro Station"
737,Apartment,2,742,58000,West Mambalam,Emerald Complex,"18, Church Street, West Mambalam, Chennai - 600032",13.039119,80.219594,"Multipurpose Room, Park",Unfurnished,2025-06-07,1500,174000,No,Deepa Iyer,8849655239,2025-03-27,1,Spacious 2BHK apartment available for rent in West Mambalam. Close to all essential facilities and public transport.,"Metro Station, Restaurant, ATM, Playground, Railway Station, Pharmacy"
738,Independent House,4,1896,291000,Ashok Nagar,Balaji Illam,"100, Gandhi Road, Ashok Nagar, Chennai - 600058",13.033326,80.213564,"Multipurpose Room, Children's Play Area, Indoor Games",Fully-furnished,2025-06-19,3800,582000,Yes,Hari Ramanathan,7542205487,2025-02-13,2,Well-maintained 4BHK independent house in a gated community. Located in the heart of Ashok Nagar with easy access to all necessities.,"Movie Theater, Bus Stop, Shopping Mall, Temple, College, School, Metro Station"
739,Independent House,1,494,56000,Chrompet,Annai Residence,"47, 2nd Street, Chrompet, Chennai - 600004",12.951261,80.145699,"Club House, RO Water System",Semi-furnished,2025-06-16,1000,168000,No,Krishna Rajendran,7359607124,2025-02-22,1,Premium 1BHK independent house in Chrompet with high-quality fittings and amenities. Perfect for family living.,"Railway Station, Shopping Mall, College, Hospital, Park, Church"
740,Apartment,2,879,84000,T. Nagar,Royal Retreat,"29, 3rd Street, T. Nagar, Chennai - 600092",13.041152,80.233116,"Club House, Intercom, Security",Unfurnished,2025-05-18,1800,252000,Yes,Deepa Parthasarathy,7079921645,2025-03-31,4,Elegant 2BHK apartment with excellent ventilation and natural light. Located in a serene neighborhood of T. Nagar.,"Church, Mosque, Park, Movie Theater, Cafe, Railway Station, Grocery Store"
741,Independent House,1,456,93000,Anna Nagar,Anbu Bhavan,"4A, 3rd Street, Anna Nagar, Chennai - 600096",13.08685,80.216987,"Shopping Center, Swimming Pool, Lift",Semi-furnished,2025-07-05,900,279000,No,Sunitha Kumar,7613111372,2025-04-02,2,Premium 1BHK independent house in Anna Nagar with high-quality fittings and amenities. Perfect for family living.,"Restaurant, Bank, Pharmacy, Gym"
742,Apartment,2,1027,76000,Valasaravakkam,Lakshmi Residences,"47, Gandhi Road, Valasaravakkam, Chennai - 600005",13.044877,80.182775,"ATM, Gated Community, Fire Safety, Multipurpose Room",Unfurnished,2025-04-29,2100,152000,Yes,Jaya Govindarajan,8434354869,2025-02-13,6,Beautiful 2BHK apartment in a prime location of Valasaravakkam. Well-ventilated and spacious rooms with modern amenities.,"Bus Stop, Gym, Church, Movie Theater"
743,Apartment,3,1233,95000,Kilpauk,Metro Arcade,"22, Church Street, Kilpauk, Chennai - 600066",13.075561,80.235308,"Service Lift, Multipurpose Room, Piped Gas, Gym, Intercom",Semi-furnished,2025-06-05,2500,285000,No,Anitha Ganapathy,9739363854,2025-03-12,4,Elegant 3BHK apartment with excellent ventilation and natural light. Located in a serene neighborhood of Kilpauk.,"Railway Station, Cafe, Pharmacy"
744,Apartment,2,745,42000,Ambattur,Modern Complex,"3A, Church Street, Ambattur, Chennai - 600004",13.115331,80.154075,"Maintenance Staff, RO Water System, 24x7 Water Supply, Indoor Games",Semi-furnished,2025-06-28,1500,84000,No,Balaji Rajan,7409079772,2025-03-26,8,Beautiful 2BHK apartment in a prime location of Ambattur. Well-ventilated and spacious rooms with modern amenities.,"Temple, ATM, Shopping Mall, Movie Theater"
745,Apartment,2,1021,57000,Porur,Lakshmi Illam,"62, Anna Salai, Porur, Chennai - 600028",13.031109,80.153112,"Fire Safety, Intercom, ATM, Lift, Power Backup",Fully-furnished,2025-06-29,2000,171000,No,Saraswathi Ramanathan,6583483483,2025-03-13,6,Spacious 2BHK apartment available for rent in Porur. Close to all essential facilities and public transport.,"Church, Playground, Park, Bank, Hospital"
746,Apartment,1,491,34000,Mylapore,Urban Castle,"43, East Street, Mylapore, Chennai - 600077",13.034544,80.268429,"24x7 Water Supply, Maintenance Staff, Security, Fire Safety, Shopping Center",Fully-furnished,2025-06-08,1000,68000,No,Venkat Pillai,6379965075,2025-02-19,2,Elegant 1BHK apartment with excellent ventilation and natural light. Located in a serene neighborhood of Mylapore.,"Railway Station, School, College, Cafe, Bank, Church"
747,Apartment,2,995,108000,Kilpauk,Grand Villas,"73, Kamaraj Salai, Kilpauk, Chennai - 600041",13.073144,80.233746,"Maintenance Staff, Cafeteria, Lift, Intercom, Reserved Parking",Unfurnished,2025-05-21,2000,216000,No,Ganesh Balasubramanian,8546305941,2025-03-05,6,Beautiful 2BHK apartment in a prime location of Kilpauk. Well-ventilated and spacious rooms with modern amenities.,"Park, Mosque, Shopping Mall, Metro Station, Railway Station"
748,Villa,3,1719,572000,Guindy,Palm Greens,"4A, North Street, Guindy, Chennai - 600091",13.007162,80.219905,"Reserved Parking, Swimming Pool, Power Backup",Semi-furnished,2025-06-08,3400,1716000,No,Saraswathi Kumar,6335186264,2025-03-30,4,Well-maintained 3BHK villa in a gated community. Located in the heart of Guindy with easy access to all necessities.,"School, Bus Stop, Hospital, Temple, Pharmacy, ATM"
749,Villa,4,2771,591000,Nungambakkam,Sovereign Haven,"3, Nehru Street, Nungambakkam, Chennai - 600006",13.055054,80.240185,"Multipurpose Room, Cafeteria, Power Backup",Unfurnished,2025-05-03,5500,1182000,No,Priya Ramachandran,8772457441,2025-03-17,3,Premium 4BHK villa in Nungambakkam with high-quality fittings and amenities. Perfect for family living.,"Hospital, Metro Station, School, Bus Stop, Railway Station, Shopping Mall, Temple"
750,Independent House,3,1545,106000,Thiruvanmiyur,Arul Home,"4B, 2nd Street, Thiruvanmiyur, Chennai - 600082",12.984469,80.256945,"Visitor Parking, Shopping Center, Reserved Parking, Park",Semi-furnished,2025-04-07,3100,318000,No,Padma Raghavan,9235433606,2025-02-19,2,Premium 3BHK independent house in Thiruvanmiyur with high-quality fittings and amenities. Perfect for family living.,"Mosque, ATM, Gym, Pharmacy, Restaurant, Hospital"
751,Independent House,2,1107,140000,Perungudi,Shiva Abode,"81, Church Street, Perungudi, Chennai - 600063",12.962564,80.250207,"ATM, Rain Water Harvesting, Security, Multipurpose Room, Club House",Fully-furnished,2025-06-16,2200,280000,Yes,Sudha Ramanathan,8670097418,2025-03-28,7,Well-maintained 2BHK independent house in a gated community. Located in the heart of Perungudi with easy access to all necessities.,"Church, School, Park, Bank, Restaurant, Temple"
752,Independent House,2,884,83000,Choolaimedu,Arul Residence,"71, Temple Street, Choolaimedu, Chennai - 600027",13.073359,80.221669,"Shopping Center, Indoor Games, Swimming Pool, Intercom, Gated Community, Service Lift",Semi-furnished,2025-05-21,1800,166000,No,Balaji Ranganathan,8724381445,2025-02-11,7,Elegant 2BHK independent house with excellent ventilation and natural light. Located in a serene neighborhood of Choolaimedu.,"Bank, Temple, School, Cafe, Movie Theater"
753,Apartment,2,776,46000,Valasaravakkam,Supreme Manor,"14, South Street, Valasaravakkam, Chennai - 600099",13.043793,80.182304,"RO Water System, Rain Water Harvesting, Visitor Parking",Semi-furnished,2025-06-03,1600,92000,Yes,Mohan Viswanathan,9702814069,2025-02-28,4,Beautiful 2BHK apartment in a prime location of Valasaravakkam. Well-ventilated and spacious rooms with modern amenities.,"Pharmacy, Metro Station, Bank"
754,Apartment,1,396,35000,Kodambakkam,Pearl Nivas,"9, 1st Street, Kodambakkam, Chennai - 600030",13.052216,80.223286,"Fire Safety, RO Water System, Children's Play Area, Shopping Center, Maintenance Staff",Unfurnished,2025-05-23,800,105000,No,Mohan Srinivasan,8457871584,2025-03-05,1,Well-maintained 1BHK apartment in a gated community. Located in the heart of Kodambakkam with easy access to all necessities.,"Church, College, Railway Station, Hospital, Cafe, Grocery Store"
755,Independent House,3,1632,300000,Thiruvanmiyur,Ganesh Home,"32, Kamaraj Salai, Thiruvanmiyur, Chennai - 600099",12.984923,80.259876,"Lift, Intercom, Security, Gated Community, Shopping Center",Fully-furnished,2025-04-10,3300,900000,No,Radha Ganapathy,6512054152,2025-03-24,5,Premium 3BHK independent house in Thiruvanmiyur with high-quality fittings and amenities. Perfect for family living.,"Restaurant, Railway Station, Pharmacy, Temple, Bank, Mosque"
756,Independent House,4,2025,265000,Vadapalani,Thiru Nilayam,"71, West Street, Vadapalani, Chennai - 600084",13.056544,80.212695,"Security, Rain Water Harvesting, Club House, 24x7 Water Supply",Unfurnished,2025-05-16,4000,795000,No,Krishna Subramanian,7354349189,2025-03-30,2,Elegant 4BHK independent house with excellent ventilation and natural light. Located in a serene neighborhood of Vadapalani.,"Temple, Mosque, Metro Station"
757,Independent House,3,1499,112000,Ashok Nagar,Thiru Nivas,"29, Main Road, Ashok Nagar, Chennai - 600097",13.034013,80.210001,"Shopping Center, Multipurpose Room, Lift, Club House, Piped Gas",Semi-furnished,2025-06-13,3000,336000,No,Krishna Parthasarathy,6234253012,2025-03-29,6,Beautiful 3BHK independent house in a prime location of Ashok Nagar. Well-ventilated and spacious rooms with modern amenities.,"Temple, Mosque, Railway Station, Hospital, Gym"
758,Apartment,2,1037,78000,KK Nagar,Elite Court,"95, Church Street, KK Nagar, Chennai - 600087",13.037478,80.19824,"Lift, Piped Gas, Power Backup, Rain Water Harvesting, RO Water System, Club House",Semi-furnished,2025-04-29,2100,234000,No,Siva Sundaram,6028385786,2025-03-07,3,Elegant 2BHK apartment with excellent ventilation and natural light. Located in a serene neighborhood of KK Nagar.,"Cafe, Restaurant, Playground, Gym, Metro Station, Hospital, Park"
759,Apartment,4,1915,164000,Madipakkam,Crystal Mahal,"6C, Gandhi Road, Madipakkam, Chennai - 600093",12.971514,80.190484,"Rain Water Harvesting, Gym, Indoor Games, Fire Safety, Lift, Gated Community",Semi-furnished,2025-04-15,3800,492000,No,Shankar Kumar,7482070015,2025-04-04,5,Elegant 4BHK apartment with excellent ventilation and natural light. Located in a serene neighborhood of Madipakkam.,"Gym, Park, ATM, College, Mosque"
760,Independent House,2,927,119000,Nungambakkam,Annai Palace,"79, Gandhi Road, Nungambakkam, Chennai - 600011",13.057819,80.244158,"Intercom, Reserved Parking, Gated Community, Shopping Center, Multipurpose Room, Swimming Pool, Club House",Semi-furnished,2025-06-25,1900,238000,Yes,Rajan Raghavan,6196213239,2025-03-01,2,Well-maintained 2BHK independent house in a gated community. Located in the heart of Nungambakkam with easy access to all necessities.,"Grocery Store, Railway Station, College, Church, Movie Theater, Metro Station"
761,Apartment,3,1280,119000,Perungudi,Supreme Arcade,"36, Gandhi Road, Perungudi, Chennai - 600085",12.965674,80.246568,"Piped Gas, Service Lift, Lift, Children's Play Area, Multipurpose Room, Gated Community",Unfurnished,2025-06-20,2600,357000,No,Vijaya Anand,9610471891,2025-03-29,2,Spacious 3BHK apartment available for rent in Perungudi. Close to all essential facilities and public transport.,"Grocery Store, Shopping Mall, Temple, Cafe, ATM, Bus Stop"
762,Villa,4,2359,887000,Thiruvanmiyur,Golden Retreat,"64, 3rd Street, Thiruvanmiyur, Chennai - 600086",12.984316,80.258515,"Piped Gas, Cafeteria, 24x7 Water Supply, Security, Indoor Games, Fire Safety",Fully-furnished,2025-04-26,4700,1774000,Yes,Sudha Shanmugam,9430234599,2025-03-09,5,Premium 4BHK villa in Thiruvanmiyur with high-quality fittings and amenities. Perfect for family living.,"School, Church, Temple"
763,Apartment,2,725,128000,Mylapore,Galaxy Retreat,"66, Cross Street, Mylapore, Chennai - 600018",13.032768,80.269145,"Maintenance Staff, Park, Power Backup",Unfurnished,2025-05-27,1400,384000,Yes,Mohan Narayanan,8759795319,2025-02-08,2,Well-maintained 2BHK apartment in a gated community. Located in the heart of Mylapore with easy access to all necessities.,"Park, Bus Stop, Railway Station, Restaurant, Temple"
764,Apartment,4,1766,79000,Perambur,Lakshmi Nivas,"9C, West Street, Perambur, Chennai - 600025",13.114524,80.242638,"Shopping Center, Swimming Pool, Multipurpose Room, Club House, Children's Play Area",Semi-furnished,2025-05-10,3500,158000,No,Srinivas Ranganathan,7393543586,2025-03-16,5,Spacious 4BHK apartment available for rent in Perambur. Close to all essential facilities and public transport.,"Shopping Mall, School, ATM, Mosque, Metro Station"
