PropertyID,PropertyType,BHK,Area,Rent,Locality,BuildingName,Address,Latitude,Longitude,Amenities,FurnishingStatus,AvailableFrom,MaintenanceCharges,Deposit,PetsAllowed,OwnerName,OwnerContact,LastUpdated,PropertyAge,Description,NearbyPlaces
355,Apartment,3,1450,66000,Velachery,White Enclave,"78, Nehru Street, Velachery, Chennai - 600074",12.982064,80.217375,"Shopping Center, Rain Water Harvesting, Indoor Games, Power Backup, Service Lift",Unfurnished,2025-06-28,2900,132000,No,Shankar Ramachandran,6804737198,2025-03-18,7,Beautiful 3BHK apartment in a prime location of Velachery. Well-ventilated and spacious rooms with modern amenities.,"Pharmacy, Playground, Church, Temple, Railway Station, Hospital"
356,Independent House,2,1177,133000,Kilpauk,Vaigai Illam,"31, 3rd Street, Kilpauk, Chennai - 600017",13.074684,80.230816,"Maintenance Staff, RO Water System, 24x7 Water Supply, Park, Service Lift",Fully-furnished,2025-04-27,2400,399000,No,Kamala Ranganathan,8879278767,2025-02-21,5,Well-maintained 2BHK independent house in a gated community. Located in the heart of Kilpauk with easy access to all necessities.,"Playground, Bank, Movie Theater, Mosque"
357,Independent House,4,2214,191000,Tambaram,Shri Abode,"6A, Cross Street, Tambaram, Chennai - 600066",12.918863,80.126842,"ATM, Gym",Unfurnished,2025-07-04,4400,382000,No,Suresh Kannan,8444340288,2025-04-01,3,Well-maintained 4BHK independent house in a gated community. Located in the heart of Tambaram with easy access to all necessities.,"ATM, Mosque, Metro Station, College, Movie Theater, Grocery Store"
358,Apartment,2,782,28000,Choolaimedu,Supreme Residency,"19A, South Street, Choolaimedu, Chennai - 600011",13.074845,80.223139,"Reserved Parking, Club House",Unfurnished,2025-04-07,1600,84000,No,Suresh Balasubramanian,7988495912,2025-04-02,7,Beautiful 2BHK apartment in a prime location of Choolaimedu. Well-ventilated and spacious rooms with modern amenities.,"ATM, Playground, Shopping Mall, Pharmacy, Temple, Church"
359,Studio Apartment,1,419,11000,Kodambakkam,Saravana Studios,"67, South Street, Kodambakkam, Chennai - 600047",13.051065,80.220068,"Gated Community, Maintenance Staff, Rain Water Harvesting",Unfurnished,2025-06-29,800,33000,No,Divya Murugan,9850711383,2025-03-20,7,Elegant 1BHK studio apartment with excellent ventilation and natural light. Located in a serene neighborhood of Kodambakkam.,"Park, Playground, Hospital, Gym"
360,Independent House,4,2212,314000,Sholinganallur,Krishna Nivas,"80, 1st Street, Sholinganallur, Chennai - 600040",12.899695,80.227862,"Indoor Games, 24x7 Water Supply, Rain Water Harvesting",Unfurnished,2025-04-10,4400,628000,Yes,Sudha Govindarajan,9613719588,2025-03-09,7,Spacious 4BHK independent house available for rent in Sholinganallur. Close to all essential facilities and public transport.,"Shopping Mall, Pharmacy, Hospital, Park, Cafe"
361,Independent House,3,1533,313000,Mylapore,Saravana Cottage,"37, Main Road, Mylapore, Chennai - 600092",13.036872,80.270358,"Gym, Piped Gas, Visitor Parking, Cafeteria, Multipurpose Room",Semi-furnished,2025-04-26,3100,626000,Yes,Mohan Pillai,8937772715,2025-02-16,3,Spacious 3BHK independent house available for rent in Mylapore. Close to all essential facilities and public transport.,"Railway Station, Metro Station, Bank, Grocery Store, Pharmacy"
362,Apartment,3,1335,69000,Nanganallur,Urban Residences,"1A, West Street, Nanganallur, Chennai - 600073",12.987147,80.190724,"Gym, Security, Shopping Center, 24x7 Water Supply, Swimming Pool",Semi-furnished,2025-06-29,2700,207000,No,Vani Rajendran,8135347050,2025-02-06,8,Elegant 3BHK apartment with excellent ventilation and natural light. Located in a serene neighborhood of Nanganallur.,"Bank, Pharmacy, Hospital, Metro Station, Playground, Church, Bus Stop"
363,Studio Apartment,2,933,56000,Ashok Nagar,Golden Studios,"5, North Street, Ashok Nagar, Chennai - 600057",13.033266,80.213024,"24x7 Water Supply, Security, Indoor Games",Semi-furnished,2025-06-27,1900,168000,Yes,Krishna Venkatesan,8427420784,2025-03-07,2,Premium 2BHK studio apartment in Ashok Nagar with high-quality fittings and amenities. Perfect for family living.,"Movie Theater, Gym, Pharmacy, Bus Stop, School, Railway Station, Cafe"
364,Apartment,4,1878,46000,Madipakkam,Sri Paradise,"49, Temple Street, Madipakkam, Chennai - 600042",12.97082,80.189208,"Gated Community, Club House, 24x7 Water Supply, RO Water System, Service Lift",Unfurnished,2025-06-03,3800,92000,No,Arun Balasubramanian,6836253666,2025-03-06,8,Premium 4BHK apartment in Madipakkam with high-quality fittings and amenities. Perfect for family living.,"Bank, Park, College, Church, School"
365,Penthouse,2,1231,754000,Ashok Nagar,Classic Ashok Nagar Penthouses,"24, North Street, Ashok Nagar, Chennai - 600009",13.036011,80.211395,"Children's Play Area, 24x7 Water Supply, Swimming Pool, Reserved Parking, Power Backup, ATM",Fully-furnished,2025-06-04,2500,1508000,No,Padma Rajendran,9290181814,2025-03-19,1,Spacious 2BHK penthouse available for rent in Ashok Nagar. Close to all essential facilities and public transport.,"Hospital, Bank, Gym, Restaurant, Temple, Movie Theater, School"
366,Studio Apartment,1,390,10000,Porur,White Studios,"90, Gandhi Road, Porur, Chennai - 600016",13.034988,80.150821,"RO Water System, Rain Water Harvesting, Security, Lift",Unfurnished,2025-06-13,800,30000,No,Mala Raghavan,9954717741,2025-03-05,7,Elegant 1BHK studio apartment with excellent ventilation and natural light. Located in a serene neighborhood of Porur.,"Gym, School, Bank"
367,Independent House,2,989,100000,Adyar,Amman Haven,"44, 1st Street, Adyar, Chennai - 600038",13.005595,80.257575,"Visitor Parking, Power Backup, Park, Rain Water Harvesting, Multipurpose Room, Reserved Parking",Unfurnished,2025-05-25,2000,300000,No,Gopal Ramachandran,9966976022,2025-02-23,2,Well-maintained 2BHK independent house in a gated community. Located in the heart of Adyar with easy access to all necessities.,"Restaurant, College, Mosque, Bus Stop, ATM, Temple, Bank"
368,Independent House,2,1031,171000,Besant Nagar,Shri Villa,"88, South Street, Besant Nagar, Chennai - 600073",12.999635,80.274166,"Visitor Parking, Service Lift, Multipurpose Room, 24x7 Water Supply",Semi-furnished,2025-06-21,2100,513000,No,Venkat Subramanian,7078136649,2025-02-06,2,Spacious 2BHK independent house available for rent in Besant Nagar. Close to all essential facilities and public transport.,"Temple, Park, Bus Stop"
369,Apartment,2,727,45000,T. Nagar,Metro Towers,"10C, South Street, T. Nagar, Chennai - 600018",13.041935,80.233161,"Reserved Parking, Shopping Center, Fire Safety, Rain Water Harvesting, Children's Play Area, Park",Semi-furnished,2025-05-10,1500,90000,No,Vijaya Ramachandran,6238368060,2025-02-27,1,Well-maintained 2BHK apartment in a gated community. Located in the heart of T. Nagar with easy access to all necessities.,"Playground, ATM, Bank"
370,Studio Apartment,2,876,28000,Velachery,Pearl Studios,"62, Avenue, Velachery, Chennai - 600045",12.984344,80.218016,"RO Water System, Cafeteria",Unfurnished,2025-04-30,1800,84000,No,Srinivas Raghavan,6731101766,2025-03-06,1,Spacious 2BHK studio apartment available for rent in Velachery. Close to all essential facilities and public transport.,"Church, Shopping Mall, Park"
371,Villa,4,2781,637000,Thiruvanmiyur,Prestige Grove,"10A, North Street, Thiruvanmiyur, Chennai - 600070",12.986477,80.25549,"RO Water System, Shopping Center",Unfurnished,2025-05-13,5600,1911000,No,Siva Ranganathan,7465517372,2025-02-14,2,Well-maintained 4BHK villa in a gated community. Located in the heart of Thiruvanmiyur with easy access to all necessities.,"Temple, Cafe, Movie Theater, Shopping Mall, Grocery Store"
372,Villa,4,2662,691000,Vadapalani,Premium Sanctuary,"53, South Street, Vadapalani, Chennai - 600082",13.057252,80.210663,"Children's Play Area, Intercom, RO Water System, Swimming Pool",Unfurnished,2025-04-16,5300,1382000,No,Deepa Viswanathan,8211194701,2025-03-09,7,Spacious 4BHK villa available for rent in Vadapalani. Close to all essential facilities and public transport.,"Movie Theater, Shopping Mall, Metro Station"
373,Villa,4,2335,636000,Velachery,Elite Haven,"91, East Street, Velachery, Chennai - 600029",12.980078,80.217008,"Service Lift, Visitor Parking, Piped Gas",Unfurnished,2025-04-19,4700,1272000,Yes,Rajan Parthasarathy,7142370485,2025-02-18,3,Spacious 4BHK villa available for rent in Velachery. Close to all essential facilities and public transport.,"School, Bus Stop, Hospital, Movie Theater, Park, Playground, Gym"
374,Villa,3,2314,290000,Sholinganallur,Green Villas,"4, Gandhi Road, Sholinganallur, Chennai - 600007",12.90163,80.228723,"Reserved Parking, Rain Water Harvesting",Semi-furnished,2025-04-29,4600,580000,No,Sunitha Venkatesh,6901873637,2025-03-08,4,Spacious 3BHK villa available for rent in Sholinganallur. Close to all essential facilities and public transport.,"ATM, Playground, Church"
375,Independent House,2,1005,93000,T. Nagar,Murugan Home,"9C, East Street, T. Nagar, Chennai - 600021",13.041602,80.235249,"Rain Water Harvesting, Cafeteria, Park, Piped Gas, Gated Community, Children's Play Area",Semi-furnished,2025-04-24,2000,186000,No,Divya Ganapathy,9640058445,2025-03-10,1,Premium 2BHK independent house in T. Nagar with high-quality fittings and amenities. Perfect for family living.,"Bus Stop, Grocery Store, Mosque, Park, Railway Station, Church"
376,Independent House,3,1496,203000,Ashok Nagar,Balaji Haven,"59, Temple Street, Ashok Nagar, Chennai - 600058",13.033514,80.212511,"Indoor Games, Multipurpose Room, Swimming Pool, Service Lift, Piped Gas, Fire Safety",Unfurnished,2025-04-29,3000,609000,No,Anitha Govindarajan,8733934741,2025-03-05,6,Well-maintained 3BHK independent house in a gated community. Located in the heart of Ashok Nagar with easy access to all necessities.,"College, Bus Stop, Railway Station, Movie Theater, Grocery Store"
377,Independent House,3,1788,168000,Medavakkam,Arul Residence,"52, South Street, Medavakkam, Chennai - 600057",12.919549,80.191639,"Children's Play Area, Shopping Center",Unfurnished,2025-07-05,3600,336000,No,Saranya Rajendran,7172319017,2025-03-29,1,Well-maintained 3BHK independent house in a gated community. Located in the heart of Medavakkam with easy access to all necessities.,"Restaurant, Pharmacy, College, Park"
378,Villa,4,2880,674000,Anna Nagar,Elite Greens,"81, 1st Street, Anna Nagar, Chennai - 600023",13.088308,80.212857,"Security, Visitor Parking, Power Backup",Semi-furnished,2025-05-12,5800,2022000,Yes,Suresh Swaminathan,9332057371,2025-02-08,5,Beautiful 4BHK villa in a prime location of Anna Nagar. Well-ventilated and spacious rooms with modern amenities.,"Gym, School, Temple, Church"
379,Apartment,3,1328,74000,Nanganallur,Royal Arcade,"86, Main Road, Nanganallur, Chennai - 600086",12.990432,80.193169,"Swimming Pool, Rain Water Harvesting",Semi-furnished,2025-06-16,2700,222000,Yes,Geetha Srinivasan,9053558823,2025-03-24,5,Beautiful 3BHK apartment in a prime location of Nanganallur. Well-ventilated and spacious rooms with modern amenities.,"Cafe, College, Temple, Mosque, Railway Station, Park, Pharmacy"
380,Independent House,2,891,104000,KK Nagar,Thamizh Mahal,"5A, West Street, KK Nagar, Chennai - 600075",13.035176,80.201588,"Shopping Center, Visitor Parking, Children's Play Area, Fire Safety",Semi-furnished,2025-07-05,1800,312000,No,Raj Raghavan,8533210125,2025-03-03,3,Well-maintained 2BHK independent house in a gated community. Located in the heart of KK Nagar with easy access to all necessities.,"School, ATM, Bank, Pharmacy, Hospital, Restaurant"
381,Apartment,2,948,137000,Royapettah,Royal Residency,"3A, North Street, Royapettah, Chennai - 600019",13.056014,80.256992,"Maintenance Staff, Visitor Parking, Reserved Parking, Children's Play Area, Club House",Fully-furnished,2025-04-19,1900,274000,No,Radha Balasubramanian,8975859883,2025-03-20,6,Spacious 2BHK apartment available for rent in Royapettah. Close to all essential facilities and public transport.,"Shopping Mall, Pharmacy, Restaurant, Bank, Movie Theater, School, ATM"
382,Penthouse,3,1915,1164000,Adyar,Deluxe Adyar Penthouses,"4A, Kamaraj Salai, Adyar, Chennai - 600057",13.005238,80.256612,"Lift, Reserved Parking, Cafeteria, Piped Gas, Indoor Games, Children's Play Area, Club House",Semi-furnished,2025-05-09,3800,2328000,No,Sunitha Narayanan,9623926572,2025-02-22,3,Well-maintained 3BHK penthouse in a gated community. Located in the heart of Adyar with easy access to all necessities.,"Grocery Store, Gym, College, Mosque, ATM, Movie Theater, Church"
383,Villa,4,2277,808000,T. Nagar,Regal Retreat,"14, Avenue, T. Nagar, Chennai - 600011",13.039661,80.235775,"Indoor Games, Reserved Parking, Security, Park, Maintenance Staff, Gated Community",Fully-furnished,2025-05-12,4600,2424000,Yes,Srinivas Krishnan,7730097465,2025-03-11,2,Well-maintained 4BHK villa in a gated community. Located in the heart of T. Nagar with easy access to all necessities.,"Gym, Shopping Mall, Cafe, Bank, Hospital, Movie Theater"
384,Studio Apartment,1,391,19000,Velachery,Golden Studios,"47, 3rd Street, Velachery, Chennai - 600046",12.98057,80.21706,"Cafeteria, Shopping Center, Piped Gas, ATM, Reserved Parking, Fire Safety",Fully-furnished,2025-05-16,800,57000,No,Sunitha Iyer,8989852588,2025-03-14,1,Spacious 1BHK studio apartment available for rent in Velachery. Close to all essential facilities and public transport.,"ATM, Hospital, Park, Playground, Gym, Church"
385,Villa,3,2205,466000,KK Nagar,Premium Paradise,"49, Avenue, KK Nagar, Chennai - 600061",13.037843,80.196787,"Gated Community, Fire Safety, Service Lift, Shopping Center, Power Backup, Piped Gas",Unfurnished,2025-05-23,4400,932000,No,Bala Rajendran,9099220896,2025-03-10,5,Spacious 3BHK villa available for rent in KK Nagar. Close to all essential facilities and public transport.,"Cafe, Metro Station, Bank, Pharmacy"
386,Independent House,2,872,112000,Anna Nagar,Shiva Mahal,"7B, Nehru Street, Anna Nagar, Chennai - 600015",13.08823,80.214294,"Shopping Center, 24x7 Water Supply, Intercom, Indoor Games, Lift, Visitor Parking",Semi-furnished,2025-05-18,1700,336000,Yes,Kavitha Venkatesan,7019255317,2025-03-29,3,Premium 2BHK independent house in Anna Nagar with high-quality fittings and amenities. Perfect for family living.,"School, ATM, Mosque, Gym, Grocery Store, Railway Station"
387,Independent House,1,481,70000,KK Nagar,Annai Nilayam,"11B, Main Road, KK Nagar, Chennai - 600019",13.036816,80.200963,"Indoor Games, Gated Community, Lift, Reserved Parking",Unfurnished,2025-04-28,1000,210000,Yes,Vikram Govindarajan,7074950443,2025-03-06,7,Well-maintained 1BHK independent house in a gated community. Located in the heart of KK Nagar with easy access to all necessities.,"Cafe, Hospital, Playground"
388,Apartment,2,752,89000,Nungambakkam,Metro Gardens,"21, Church Street, Nungambakkam, Chennai - 600003",13.055978,80.240042,"Cafeteria, Gym, Power Backup, Indoor Games, Multipurpose Room, Swimming Pool, Rain Water Harvesting",Unfurnished,2025-05-10,1500,178000,No,Kavitha Ramanathan,9612034717,2025-03-01,3,Well-maintained 2BHK apartment in a gated community. Located in the heart of Nungambakkam with easy access to all necessities.,"Playground, Railway Station, Bus Stop"
389,Apartment,2,853,66000,Kodambakkam,Lakshmi Illam,"43, East Street, Kodambakkam, Chennai - 600069",13.050128,80.222282,"Children's Play Area, Club House, Cafeteria, Lift, Swimming Pool",Semi-furnished,2025-06-21,1700,198000,Yes,Ramesh Iyer,8579706734,2025-03-02,5,Beautiful 2BHK apartment in a prime location of Kodambakkam. Well-ventilated and spacious rooms with modern amenities.,"Hospital, Temple, ATM, Restaurant"
390,Independent House,5,2875,513000,Mylapore,Durga Illam,"93, North Street, Mylapore, Chennai - 600025",13.03379,80.267653,"Shopping Center, ATM, Cafeteria",Semi-furnished,2025-05-28,5800,1026000,No,Vikram Murugan,7080910069,2025-03-17,3,Well-maintained 5BHK independent house in a gated community. Located in the heart of Mylapore with easy access to all necessities.,"College, Cafe, Restaurant, Church, Movie Theater, Pharmacy, Mosque"
391,Studio Apartment,1,428,22000,Porur,Green Studios,"20, Kamaraj Salai, Porur, Chennai - 600058",13.033614,80.151298,"Gym, Shopping Center",Unfurnished,2025-04-23,900,44000,No,Rajan Sundaram,7967776192,2025-03-15,1,Premium 1BHK studio apartment in Porur with high-quality fittings and amenities. Perfect for family living.,"Movie Theater, Temple, Playground, Metro Station, Shopping Mall, Church, Gym"
392,Apartment,2,903,94000,Guindy,Prestige Plaza,"82, 2nd Street, Guindy, Chennai - 600039",13.00755,80.221226,"Lift, Cafeteria, Piped Gas, Gym, Club House, Service Lift",Semi-furnished,2025-05-02,1800,188000,No,Deepa Chandran,8896298532,2025-04-03,3,Premium 2BHK apartment in Guindy with high-quality fittings and amenities. Perfect for family living.,"School, College, ATM, Mosque, Movie Theater, Church"
393,Apartment,2,786,85000,Sholinganallur,Saravana Towers,"97, Avenue, Sholinganallur, Chennai - 600008",12.899541,80.227919,"Intercom, Power Backup, Piped Gas",Semi-furnished,2025-05-11,1600,170000,No,Raj Pillai,7100794193,2025-03-01,2,Spacious 2BHK apartment available for rent in Sholinganallur. Close to all essential facilities and public transport.,"Movie Theater, Restaurant, Mosque, Bank, Cafe, Metro Station"
394,Independent House,2,978,94000,Nungambakkam,Shri Palace,"4, West Street, Nungambakkam, Chennai - 600018",13.058332,80.242535,"Swimming Pool, RO Water System, Club House, Security, Park",Fully-furnished,2025-05-21,2000,188000,Yes,Mohan Ranganathan,9653020068,2025-03-19,4,Spacious 2BHK independent house available for rent in Nungambakkam. Close to all essential facilities and public transport.,"Metro Station, Bus Stop, ATM, Pharmacy, Shopping Mall"
395,Studio Apartment,2,775,70000,T. Nagar,Elegant Studios,"13B, West Street, T. Nagar, Chennai - 600089",13.042384,80.2334,"Rain Water Harvesting, Service Lift, Swimming Pool",Semi-furnished,2025-05-23,1600,210000,No,Suresh Pillai,8880153150,2025-03-22,1,Elegant 2BHK studio apartment with excellent ventilation and natural light. Located in a serene neighborhood of T. Nagar.,"Shopping Mall, Bus Stop, Hospital, Park, Bank"
396,Independent House,2,885,108000,Medavakkam,Thiru Residence,"71, Anna Salai, Medavakkam, Chennai - 600061",12.918967,80.192568,"Indoor Games, Gym, Multipurpose Room, Club House, Children's Play Area",Semi-furnished,2025-06-08,1800,324000,Yes,Venkat Iyengar,6840541652,2025-02-06,4,Well-maintained 2BHK independent house in a gated community. Located in the heart of Medavakkam with easy access to all necessities.,"Bus Stop, Metro Station, Shopping Mall, Playground, Movie Theater, Church, Pharmacy"
397,Villa,3,1755,672000,Kilpauk,Luxe Retreat,"39, Nehru Street, Kilpauk, Chennai - 600033",13.071284,80.233617,"Maintenance Staff, Club House, ATM, Visitor Parking, Lift, Rain Water Harvesting",Fully-furnished,2025-04-21,3500,1344000,No,Raj Govindarajan,7366899570,2025-02-12,3,Spacious 3BHK villa available for rent in Kilpauk. Close to all essential facilities and public transport.,"Church, Railway Station, Playground, Movie Theater, Hospital, Cafe, School"
398,Villa,4,2234,656000,Adyar,Royal Greens,"46, Church Street, Adyar, Chennai - 600032",13.004108,80.254254,"Piped Gas, Lift, Indoor Games, Gated Community, Gym, Power Backup, ATM",Semi-furnished,2025-05-25,4500,1968000,Yes,Rajan Sampath,7718344998,2025-04-03,3,Spacious 4BHK villa available for rent in Adyar. Close to all essential facilities and public transport.,"Mosque, Railway Station, Temple, Bus Stop"
399,Independent House,1,518,63000,Adyar,Arun Home,"41, Temple Street, Adyar, Chennai - 600070",13.007445,80.258249,"Service Lift, Piped Gas, ATM, Multipurpose Room, Indoor Games, Security",Semi-furnished,2025-07-02,1000,126000,No,Siva Venkatesh,6345129519,2025-03-21,4,Well-maintained 1BHK independent house in a gated community. Located in the heart of Adyar with easy access to all necessities.,"Church, Grocery Store, Cafe, Playground"
400,Apartment,2,731,92000,Mogappair,Elegant Illam,"4, Gandhi Road, Mogappair, Chennai - 600080",13.088457,80.199797,"Security, Cafeteria, Fire Safety, ATM, Swimming Pool",Fully-furnished,2025-04-18,1500,276000,Yes,Divya Iyengar,9652669300,2025-03-07,4,Spacious 2BHK apartment available for rent in Mogappair. Close to all essential facilities and public transport.,"Restaurant, Bus Stop, School"
401,Villa,3,1955,389000,Adyar,Regal Estate,"2C, Kamaraj Salai, Adyar, Chennai - 600073",13.006923,80.257891,"Swimming Pool, Shopping Center, Service Lift, ATM",Unfurnished,2025-04-30,3900,778000,No,Radha Natarajan,7018101290,2025-03-24,1,Beautiful 3BHK villa in a prime location of Adyar. Well-ventilated and spacious rooms with modern amenities.,"Movie Theater, Gym, Cafe, School, Hospital, Shopping Mall"
402,Apartment,3,1508,38000,Medavakkam,Lakshmi Habitat,"69, 2nd Street, Medavakkam, Chennai - 600034",12.91834,80.191535,"Swimming Pool, Park, Service Lift, Reserved Parking, Lift, Shopping Center",Unfurnished,2025-05-06,3000,114000,No,Krishna Parthasarathy,6899749030,2025-03-10,5,Premium 3BHK apartment in Medavakkam with high-quality fittings and amenities. Perfect for family living.,"Grocery Store, ATM, Pharmacy"
403,Independent House,4,1792,226000,Anna Nagar,Thiru House,"9, Nehru Street, Anna Nagar, Chennai - 600096",13.085439,80.216683,"Service Lift, Security, Maintenance Staff",Fully-furnished,2025-05-20,3600,678000,No,Suresh Krishnan,8891435354,2025-03-18,2,Premium 4BHK independent house in Anna Nagar with high-quality fittings and amenities. Perfect for family living.,"Playground, Church, Cafe, Restaurant, College"
404,Apartment,2,929,94000,Kodambakkam,Supreme Villas,"1A, West Street, Kodambakkam, Chennai - 600090",13.052275,80.223673,"Intercom, Indoor Games",Unfurnished,2025-05-30,1900,188000,Yes,Sudha Sampath,7773522870,2025-02-17,3,Beautiful 2BHK apartment in a prime location of Kodambakkam. Well-ventilated and spacious rooms with modern amenities.,"Playground, Mosque, Gym, Metro Station, Grocery Store, Restaurant"
405,Apartment,3,1514,135000,Besant Nagar,Diamond Mahal,"4B, 2nd Street, Besant Nagar, Chennai - 600046",12.996477,80.26993,"Visitor Parking, Swimming Pool, Children's Play Area, Lift, Piped Gas, Reserved Parking, Rain Water Harvesting",Semi-furnished,2025-04-15,3000,405000,No,Bala Srinivasan,9165276136,2025-02-25,5,Well-maintained 3BHK apartment in a gated community. Located in the heart of Besant Nagar with easy access to all necessities.,"ATM, Hospital, Church, Restaurant, Park, Grocery Store, Shopping Mall"
406,Apartment,1,451,61000,Besant Nagar,Prime Haven,"4A, North Street, Besant Nagar, Chennai - 600031",12.996862,80.272294,"Security, Swimming Pool, Maintenance Staff",Unfurnished,2025-05-10,900,122000,No,Suresh Sampath,7200461526,2025-03-02,3,Beautiful 1BHK apartment in a prime location of Besant Nagar. Well-ventilated and spacious rooms with modern amenities.,"Shopping Mall, Railway Station, Restaurant"
407,Apartment,2,823,74000,Thiruvanmiyur,Modern Enclave,"29, Anna Salai, Thiruvanmiyur, Chennai - 600026",12.984595,80.258012,"Power Backup, Club House, Lift, Gated Community, Fire Safety",Unfurnished,2025-05-10,1600,222000,No,Balaji Chandran,7310278681,2025-03-23,3,Well-maintained 2BHK apartment in a gated community. Located in the heart of Thiruvanmiyur with easy access to all necessities.,"Temple, Gym, ATM"
408,Apartment,3,1486,128000,Anna Nagar,Diamond Habitat,"63, Nehru Street, Anna Nagar, Chennai - 600034",13.087063,80.216967,"Gated Community, Service Lift, Piped Gas, Reserved Parking",Unfurnished,2025-05-03,3000,384000,Yes,Anitha Subramanian,6211359804,2025-02-21,2,Elegant 3BHK apartment with excellent ventilation and natural light. Located in a serene neighborhood of Anna Nagar.,"College, Hospital, Metro Station, Bus Stop, Mosque, ATM"
409,Apartment,3,1323,39000,Perambur,City Retreat,"11B, Kamaraj Salai, Perambur, Chennai - 600067",13.114599,80.238811,"Indoor Games, Club House",Unfurnished,2025-04-28,2600,78000,Yes,Vijay Shanmugam,7501137535,2025-03-23,9,Premium 3BHK apartment in Perambur with high-quality fittings and amenities. Perfect for family living.,"Shopping Mall, Playground, Church"
410,Apartment,2,831,72000,Perungudi,Deluxe Arcade,"10, South Street, Perungudi, Chennai - 600034",12.965389,80.24946,"Swimming Pool, Visitor Parking, Lift",Unfurnished,2025-05-07,1700,216000,No,Deepa Raghavan,6365905041,2025-03-09,8,Spacious 2BHK apartment available for rent in Perungudi. Close to all essential facilities and public transport.,"Movie Theater, Restaurant, Park"
411,Penthouse,2,1077,702000,T. Nagar,Grand T. Nagar Penthouses,"5C, Anna Salai, T. Nagar, Chennai - 600067",13.039801,80.232291,"Security, Fire Safety, RO Water System, Club House, Intercom, Service Lift, Rain Water Harvesting",Unfurnished,2025-06-27,2200,1404000,No,Meena Iyer,9521664445,2025-03-07,1,Spacious 2BHK penthouse available for rent in T. Nagar. Close to all essential facilities and public transport.,"Mosque, Metro Station, Bank, Park, Hospital, Cafe, Pharmacy"
412,Independent House,5,2940,192000,Perambur,Balaji Nivas,"51, Kamaraj Salai, Perambur, Chennai - 600047",13.11535,80.241302,"24x7 Water Supply, Fire Safety, Park, Maintenance Staff",Unfurnished,2025-04-12,5900,384000,No,Venkat Iyer,8940275942,2025-02-10,6,Premium 5BHK independent house in Perambur with high-quality fittings and amenities. Perfect for family living.,"Railway Station, Gym, Hospital, Pharmacy, Bus Stop, Church, Movie Theater"
